{
  "name": "Refund a test-mode transaction",
  "description": "<p>Refund a test-mode Transaction.</p>",
  "meta": {
    "method": "POST",
    "operationId": "postTestHelpersIssuingTransactionsTransactionRefund",
    "path": "/v1/test_helpers/issuing/transactions/{transaction}/refund",
    "provider": "stripe"
  },
  "input": {
    "authBearerAuth": "<string>",
    "body": {
      "expand": [
        "<string>"
      ],
      "refund_amount": "<number>"
    },
    "pathTransaction": "<string>"
  },
  "inputRequired": [
    "pathTransaction"
  ],
  "ruleset": {
    "_pbd_hazlo_type": "api_req",
    "body": {
      "_pbd_hazlo_type": "var",
      "id": "ebb8392312e8",
      "keyPath": "body",
      "optional": true
    },
    "headers": {
      "Authorization": {
        "_pbd_hazlo_type": "concat",
        "id": "c3a416782c07",
        "left": "Bearer ",
        "right": {
          "_pbd_hazlo_type": "var",
          "id": "cb3ce412f4fd",
          "keyPath": "authBearerAuth",
          "optional": true
        }
      }
    },
    "host": "https://api.stripe.com",
    "id": "ea5eb9dd902f",
    "method": "POST",
    "path": {
      "_pbd_hazlo_type": "concat",
      "id": "a5e4cf3e2174",
      "left": {
        "_pbd_hazlo_type": "concat",
        "id": "024370617da8",
        "left": "/v1/test_helpers/issuing/transactions/",
        "right": {
          "_pbd_hazlo_type": "var",
          "id": "c3628695a42f",
          "keyPath": "pathTransaction",
          "optional": false
        }
      },
      "right": "/refund"
    },
    "query": {}
  }
}
