{
  "name": "Retrieve a quote's upfront line items",
  "description": "<p>When retrieving a quote, there is an includable <a href=\"https://stripe.com/docs/api/quotes/object#quote_object-computed-upfront-line_items\"><strong>computed.upfront.line_items</strong></a> property containing the first handful of those items. There is also a URL where you can retrieve the full (paginated) list of upfront line items.</p>",
  "meta": {
    "method": "GET",
    "operationId": "getQuotesQuoteComputedUpfrontLineItems",
    "path": "/v1/quotes/{quote}/computed_upfront_line_items",
    "provider": "stripe"
  },
  "input": {
    "authBearerAuth": "<string>",
    "body": {},
    "pathQuote": "<string>",
    "queryEndingBefore": "<string>",
    "queryExpand": [],
    "queryLimit": "<number>",
    "queryStartingAfter": "<string>"
  },
  "inputRequired": [
    "pathQuote"
  ],
  "ruleset": {
    "_pbd_nebula_type": "api_req",
    "body": {
      "_pbd_nebula_type": "var",
      "id": "b35c6f6b4a5b",
      "keyPath": "body",
      "optional": true
    },
    "headers": {
      "Authorization": {
        "_pbd_nebula_type": "concat",
        "id": "ff1b0e1a5ef9",
        "left": "Bearer ",
        "right": {
          "_pbd_nebula_type": "var",
          "id": "59720931ba76",
          "keyPath": "authBearerAuth",
          "optional": true
        }
      }
    },
    "host": "https://api.stripe.com",
    "id": "873d9dc80d86",
    "method": "GET",
    "path": {
      "_pbd_nebula_type": "concat",
      "id": "1a8ffb3f705a",
      "left": {
        "_pbd_nebula_type": "concat",
        "id": "3f90fda4ccb0",
        "left": "/v1/quotes/",
        "right": {
          "_pbd_nebula_type": "var",
          "id": "7a157501e58c",
          "keyPath": "pathQuote",
          "optional": false
        }
      },
      "right": "/computed_upfront_line_items"
    },
    "query": {
      "ending_before": {
        "_pbd_nebula_type": "var",
        "id": "579f42946d63",
        "keyPath": "queryEndingBefore",
        "optional": true
      },
      "expand": {
        "_pbd_nebula_type": "var",
        "id": "f2363a0f1f2e",
        "keyPath": "queryExpand",
        "optional": true
      },
      "limit": {
        "_pbd_nebula_type": "var",
        "id": "6eba5e90f34d",
        "keyPath": "queryLimit",
        "optional": true
      },
      "starting_after": {
        "_pbd_nebula_type": "var",
        "id": "649b6eb1d0c3",
        "keyPath": "queryStartingAfter",
        "optional": true
      }
    }
  }
}
