{
  "name": "Cancel a payout",
  "description": "<p>You can cancel a previously created payout if its status is <code>pending</code>. Stripe refunds the funds to your available balance. You can’t cancel automatic Stripe payouts.</p>",
  "meta": {
    "method": "POST",
    "operationId": "postPayoutsPayoutCancel",
    "path": "/v1/payouts/{payout}/cancel",
    "provider": "stripe"
  },
  "input": {
    "authBearerAuth": "<string>",
    "body": {
      "expand": [
        "<string>"
      ]
    },
    "pathPayout": "<string>"
  },
  "inputRequired": [
    "pathPayout"
  ],
  "ruleset": {
    "_pbd_nebula_type": "api_req",
    "body": {
      "_pbd_nebula_type": "var",
      "id": "c6ba92382aa0",
      "keyPath": "body",
      "optional": true
    },
    "headers": {
      "Authorization": {
        "_pbd_nebula_type": "concat",
        "id": "66268083b4e0",
        "left": "Bearer ",
        "right": {
          "_pbd_nebula_type": "var",
          "id": "2f65f4b6a72a",
          "keyPath": "authBearerAuth",
          "optional": true
        }
      }
    },
    "host": "https://api.stripe.com",
    "id": "c4dd8298bc21",
    "method": "POST",
    "path": {
      "_pbd_nebula_type": "concat",
      "id": "fdcc41026842",
      "left": {
        "_pbd_nebula_type": "concat",
        "id": "e42c9dbf354d",
        "left": "/v1/payouts/",
        "right": {
          "_pbd_nebula_type": "var",
          "id": "4fabaf7f4b33",
          "keyPath": "pathPayout",
          "optional": false
        }
      },
      "right": "/cancel"
    },
    "query": {}
  }
}
