{
  "name": "Create a tax ID",
  "description": "<p>Creates a new account or customer <code>tax_id</code> object.</p>",
  "meta": {
    "method": "POST",
    "operationId": "postTaxIds",
    "path": "/v1/tax_ids",
    "provider": "stripe"
  },
  "input": {
    "authBearerAuth": "<string>",
    "body": {
      "expand": [
        "<string>"
      ],
      "owner": {
        "account": "<string>",
        "customer": "<string>",
        "customer_account": "<string>",
        "type": "account"
      },
      "type": "ad_nrt",
      "value": "<string>"
    }
  },
  "inputRequired": [
    "body"
  ],
  "ruleset": {
    "_pbd_hazlo_type": "api_req",
    "body": {
      "_pbd_hazlo_type": "var",
      "id": "89ade32d39db",
      "keyPath": "body",
      "optional": false
    },
    "headers": {
      "Authorization": {
        "_pbd_hazlo_type": "concat",
        "id": "2284c40caed6",
        "left": "Bearer ",
        "right": {
          "_pbd_hazlo_type": "var",
          "id": "9a8fafaee713",
          "keyPath": "authBearerAuth",
          "optional": true
        }
      }
    },
    "host": "https://api.stripe.com",
    "id": "c05975d9bbae",
    "method": "POST",
    "path": "/v1/tax_ids",
    "query": {}
  }
}
